{
  "schemaVersion": 1,
  "profile": "bundle-model",
  "id": "D1-TSUKIOKA-RECEIVED-EATING",
  "sourceRevision": 2,
  "screenUnit": "SCR-SVC-CUSTOMERS",
  "semanticOwner": "artist-3.d1-drink-service-cleanup-customer-settlement",
  "assetMeaning": "One furniture-free post-receipt state alternating exactly two frames every 1200ms: eat-negima and drink-draft-beer.",
  "artifacts": [
    {"role": "frame-eat-negima", "file": "../assets/d1-tsukioka-received-eating-eat-negima-r2.png", "sha256": "5a1e526672aad1eba9e50842ee4bdf0310f8564a9b6aa7c605aecd8fcac0525c", "bytes": 306454, "format": "png", "dimensions": {"width": 1920, "height": 1080}},
    {"role": "frame-drink-draft-beer", "file": "../assets/d1-tsukioka-received-eating-drink-draft-beer-r2.png", "sha256": "973d568259f25c1711e4924d3b063b59ba82962c1dfcaddc418d3735aeef6ee3", "bytes": 304646, "format": "png", "dimensions": {"width": 1920, "height": 1080}},
    {"role": "frame-manifest", "file": "frame-manifest.json", "sha256": "4b9291b99962d54fe9f9623b4c16aacc1d7631ba12504aa1922de70fc4d122b7", "bytes": 1341, "format": "json"}
  ],
  "technicalReview": {
    "result": "passed",
    "checks": [
      "one semantic stable ID with exactly two alternating frame artifacts",
      "eat-negima frame has one negima and no beer",
      "drink-draft-beer frame has one beer mug and no negima",
      "both frames are furniture-free straight-alpha FHD layers with transparent corners",
      "both frames preserve canonical top y215, height 690 and center x1086",
      "frame manifest retains 1200ms interval"
    ]
  },
  "approval": {"status": "approved-by-user", "date": "2026-08-03", "basis": "사용자 응답: 승인"},
  "runtimeRegistrationAllowed": false
}
